,neg,neu,pos,compound,headline,label
0,0.0,1.0,0.0,0.0,Roughly 47 million people quit their jobs last year: ‘All of this is uncharted territory’,0
1,0.0,0.723,0.277,0.3182,Practices to increase my attention to detail,1
2,0.136,0.651,0.213,0.3182,Has anyone bothered looking into the get rich quick scheme advertised on youtube?,1
3,0.267,0.733,0.0,-0.6249,Austria says use of Google Analytics is illegal because it exposes Europeans to U.S. spy agencies,-1
4,0.0,0.792,0.208,0.2732,PepsiCo to launch hemp seed-infused drink under Rockstar Energy,1
5,0.0,0.758,0.242,0.4939,The Trade Agreement between Ukraine and Turkey: what do you think?,1
6,0.092,0.719,0.19,0.3612,Starbucks posts mixed results as higher costs and Covid pay weigh on profits,1
7,0.163,0.65,0.187,0.0772,Ford reports mixed fourth quarter results as chip shortage eases,0
8,0.0,1.0,0.0,0.0,"As Omicron surge began, Americans quit their jobs at near-record rates",0
9,0.0,1.0,0.0,0.0,Tobacco Farm - Seed Company Idea,0
10,0.0,0.755,0.245,0.3818,Cart.com Closes $240M New Funding As Explosive Growth Continues,1
11,0.0,0.879,0.121,0.296,What’s next: The ‘Great Resignation’ | Dean of business school shares insights into record-setting turnover among US employees,1
12,0.19,0.661,0.149,-0.128,Jeff Zucker Resigns From CNN After Relationship With Top Executive,-1
13,0.0,0.878,0.122,0.2023,"Metaverse real estate sales top $500 million, and are projected to double this year",1
14,0.149,0.851,0.0,-0.2732,"ADP jobs report January 2022: Companies cut 301,000 as omicron slams labor market",-1
15,0.0,1.0,0.0,0.0,Passing equipment cost on to client???,0
16,0.0,1.0,0.0,0.0,"Sony acquires Bungie, studio behind Destiny 2, in $3.6B deal",0
17,0.0,1.0,0.0,0.0,Anyone dealing with cargo theft?,0
18,0.204,0.796,0.0,-0.3182,Facebook CEO Mark Zuckerberg loses $30 billion in 24 hours,-1
19,0.0,0.694,0.306,0.296,Facebook shares plunge on weaker-than-expected earnings,1
20,0.0,1.0,0.0,0.0,W-4 and W-9 form questions,0
21,0.0,0.476,0.524,0.5267,Amazon reportedly interested in buying Peloton,1
22,0.0,0.892,0.108,0.1779,How could partnering with Amazon as an additional sales channel affect an established clothing brand?,1
23,0.0,0.455,0.545,0.8689,"Columbia CEO says early holiday shopping helped boost Q4 profitability, expects strong 2022",1
24,0.283,0.5,0.217,-0.2023,Is there a place to report credit card fraudsters?,-1
25,0.0,1.0,0.0,0.0,Company pulling product for selling too cheap?,0
26,0.098,0.902,0.0,-0.0516,Hiring is hard now. But so is keeping the workers you have.,0
27,0.279,0.721,0.0,-0.5653,"Despite labor movement popularity, U.S. union membership is as low as it's ever been",-1
28,0.167,0.833,0.0,-0.3818,Near-Record 4.3 Million Americans Quit Jobs In December As Layoffs Hit Lowest Level Ever,-1
29,0.0,1.0,0.0,0.0,"Alphabet stock split may trigger retail buying, Dow inclusion",0
30,0.0,1.0,0.0,0.0,Client Breakup,0
31,0.149,0.684,0.167,0.0613,Helping organize small family trucking business. Not sure where to start,0
32,0.0,1.0,0.0,0.0,Alphabet stock split could pave the way for addition to the Dow Jones Industrial Average,0
33,0.0,0.852,0.148,0.3818,'This is a big deal': How Apple earnings can grow even if iPhone growth goes to zero,1
34,0.0,1.0,0.0,0.0,How does MTV Music Television survive?,0
35,0.375,0.625,0.0,-0.6597,Meta Suffers Largest One-Day Wipeout in US History With $240B Loss,-1
36,0.155,0.845,0.0,-0.296,"AT&T to spin off WarnerMedia in $43 billion Discovery media merger, cuts dividend",-1
37,0.0,1.0,0.0,0.0,Cloud computing and virtualization company Citrix to be acquired for $16.5B,0
38,0.161,0.839,0.0,-0.3182,"All in a day: Zuckerberg loses $29 bln, Bezos set to pocket $20 bln",-1
39,0.0,1.0,0.0,0.0,Presenting onboarding materials for 80 FTE business unit,0
40,0.0,1.0,0.0,0.0,Meta's Earnings Are Coming. The Focus Is Still on Facebook and Instagram.,0
41,0.0,0.9,0.1,0.2732,"The average venture investor spends 3.5 minutes watching a deck, according to the latest data. And yet you create 30-slide presentations.",1
42,0.0,1.0,0.0,0.0,Why such garbage,0
43,0.0,1.0,0.0,0.0,Morgan Stanley says Tesla will surpass GM + Ford combined revenue by 2027,0
44,0.0,0.573,0.427,0.7717,Found this super helpful for my new business (in online commerce).,1
45,0.0,1.0,0.0,0.0,Do you need a business to host a tournament?,0
46,0.0,1.0,0.0,0.0,Advice for venturing into the business world without a traditional business degree?,0
47,0.0,0.526,0.474,0.4019,Hello People- Need Help,1
48,0.0,1.0,0.0,0.0,GM is launching a used car marketplace - CNN Video,0
49,0.0,1.0,0.0,0.0,Opinion | Wonking Out: Are We in Another Housing Bubble?,0
50,0.14,0.766,0.095,-0.25,"Managers of Reddit, is it unfair to expect a technical person to also assume non-technical responsibilities and do it well?",-1
51,0.318,0.682,0.0,-0.4215,"Struggling to fund my business, need advice",-1
52,0.0,1.0,0.0,0.0,Job openings rose to 10.925 million in December,0
53,0.123,0.877,0.0,-0.1027,Bank of America CEO's pay rises more than 30% for 2021,-1
54,0.0,0.708,0.292,0.5106,AMD rises 10% after issuing strong 2022 sales outlook,1
55,0.18,0.82,0.0,-0.296,"AT&T to spin off WarnerMedia in $43-bln Discovery merger, cuts dividend",-1
56,0.0,1.0,0.0,0.0,Alphabet reports big beat on earnings and revenue,0
57,0.167,0.833,0.0,-0.296,Google Stock: Alphabet (GOOG) Stock Split at Lower Price Targets Small Investors,-1
58,0.0,1.0,0.0,0.0,Connecting business people - how can I participate?,0
59,0.0,1.0,0.0,0.0,Sony to buy video game maker Bungie in $3.6 billion deal,0
60,0.0,1.0,0.0,0.0,Outdoorsy/turo renting out a vehicle,0
61,0.0,1.0,0.0,0.0,Back to the drawing board Close & Retry,0
62,0.561,0.439,0.0,-0.91,"Report on Rio Tinto finds 'disturbing' culture of sexual harassment, racism, bullying",-1
63,0.075,0.862,0.063,-0.1027,Ok so if someone has competitor information on a startup company that was going to threaten a larger corporation. How do they get ahold of someone in those corporations to pass this info along?,-1
64,0.0,1.0,0.0,0.0,What to do with extra $,0
65,0.0,1.0,0.0,0.0,Bringing on a partner? How would that work?,0
66,0.28,0.72,0.0,-0.3612,"'Significant' risk of the US economy shrinking this quarter, BofA warns",-1
67,0.0,1.0,0.0,0.0,This microbusiness owner is riding a roller-coaster,0
68,0.0,0.682,0.318,0.6369,Best Buy could cash in from rise of the metaverse,1
69,0.0,0.776,0.224,0.4902,Are people willing to drive 10~15 minutes more for better shopping experience?,1
70,0.0,0.891,0.109,0.296,Netflix boss Reed Hastings snapped up $20 million in shares of the streaming giant after its stock plummeted 30%,1
71,0.265,0.735,0.0,-0.5574,Question about Illegal businesses and running a business out of your house,-1
72,0.0,1.0,0.0,0.0,What does a business insights analyst do? What are the career progression paths that one could go down if they were to start as an insights analyst?,0
73,0.0,1.0,0.0,0.0,Did Neuralink mislead the SEC about Elon Musk's role at the company?,0
74,0.0,0.786,0.214,0.4588,Goldman Sachs awards its C.E.O. a raise to $35 million after a record year.,1
75,0.0,0.815,0.185,0.3612,Hi i am planning to start a business consultation company i would like your advices,1
76,0.0,1.0,0.0,0.0,How are companies such as eBay not copyright infringing?,0
77,0.0,0.806,0.194,0.1139,Apple sales soar despite chip supply shortages,1
78,0.0,1.0,0.0,0.0,US economy grows at fastest pace in decades,0
79,0.306,0.694,0.0,-0.296,Where are Britain's missing million workers?,-1
80,0.0,1.0,0.0,0.0,Vast DOJ Probe Looks at Almost 30 Short-Selling Firms and Allies,0
81,0.441,0.559,0.0,-0.6486,Mark Zuckerberg risks losing $34 billion in a day after Meta shocker,-1
82,0.0,1.0,0.0,0.0,Buyout Cost for a business?,0
83,0.0,1.0,0.0,0.0,What can i buy in bulk and resell with 10 000 eur ?,0
84,0.184,0.816,0.0,-0.4019,Billionaire Facebook Investor Peter Thiel Secretly Funded A ‘Cyber Warfare’ Startup That Hacked WhatsApp,-1
85,0.0,1.0,0.0,0.0,Google parent Alphabet announces 20-for-1 stock split,0
86,0.0,1.0,0.0,0.0,"If I buy a business in the USA, will it shorten the green card process?",0
87,0.0,0.419,0.581,0.8885,Amazon shares soar on cloud revenue beat and huge profit gain from Rivian stake,1
88,0.124,0.876,0.0,-0.1779,"Wordle, the game everyone's obsessed with, gets bought by the New York Times",-1
89,0.0,0.87,0.13,0.2732,Is it possible to create an LLC in Deleware 50/50 with a none resident foreign citizen?,1
90,0.0,1.0,0.0,0.0,Wall Street Paid Out Over $150 Billion In Compensation In 2021,0
91,0.0,1.0,0.0,0.0,Former Pandora Jewelry president Scott Burger to take over as Alex and Ani’s new CEO - The Boston Globe,0
92,0.0,1.0,0.0,0.0,FedEx suspends some domestic freight services due to Omicron hit,0
93,0.09,0.787,0.122,0.2263,"FB's owner Meta saw its stock market value slump by over $230bn on Thursday, in a record daily loss for a US firm. Its shares fell 26.4% after quarterly figures disappointed investors. Meta also said that FB's daily active users (DAUs) had dropped for the first time in 18 years. Is FB dying out?",1
94,0.0,1.0,0.0,0.0,"Mark Zuckerberg told Meta employees to zero in on video because they're up against an 'unprecedented level of competition' from TikTok, report says",0
95,0.187,0.714,0.098,-0.25,Spotify's shares dropped by 12% after Neil Young demanded his songs be removed from the platform over 'COVID-19 misinformation',-1
96,0.0,1.0,0.0,0.0,I have an idea..,0
97,0.0,0.69,0.31,0.4019,Opinion | Help Still Wanted at Small Firms,1
98,0.0,0.856,0.144,0.6421,The Super Bowl makes millions in ad revenue but wouldn't pay hundreds of dancers this year. Performers ask whether getting paid in 'exposure' is worth it. Experienced dancers say unpaid work for exposure is common in the industry - Business Insider,1
99,0.0,0.578,0.422,0.8074,"A year on, GameStop champion Roaring Kitty is quiet -- yet much richer",1
100,0.0,1.0,0.0,0.0,Russia tells Germany it's open to ending media row,0
101,0.0,1.0,0.0,0.0,Google to invest up to $1 billion in Indian telecom operator Airtel,0
102,0.0,0.888,0.112,0.2263,"I've received an opportunity that is incredible for my business, but don't know what I should do.",1
103,0.0,1.0,0.0,0.0,"Meta set for US$195B wipeout, biggest in market history - BNN Bloomberg",0
104,0.351,0.649,0.0,-0.4019,Do companies deliberately make inferior products?,-1
105,0.291,0.709,0.0,-0.6249,"""Meta Set for $200 Billion Wipeout, Among Worst in Market History""",-1
106,0.0,0.58,0.42,0.4404,Easy way to earn 100$,1
107,0.0,0.696,0.304,0.3612,Top White House Aide Brother Paid Big $$$ By Amazon,1
108,0.0,0.556,0.444,0.7351,PepsiCo launches hemp seed-infused energy drinks aimed at helping people to relax,1
109,0.0,1.0,0.0,0.0,"Cafes and restaurants, is it really a big deal when a customer pees all over the toilet floor?",0
110,0.0,1.0,0.0,0.0,$15k “market adjustment” at Toyota,0
111,0.0,0.739,0.261,0.5574,Amazon reveals 17% hike in Prime membership fee to offset rising costs as profits surge,1
112,0.0,0.857,0.143,0.128,IMF urges El Salvador to remove Bitcoin as legal tender,1
113,0.0,0.855,0.145,0.1779,U.S. stock futures rally after earnings reports from Amazon and Snapchat,1
114,0.0,0.848,0.152,0.3612,Corporate landlords like Blackstone are riding this inflationary wave all the way to the bank,1
115,0.0,0.861,0.139,0.4404,"Question for those with a business degree, how useful would you say your degree and the information you learned was?",1
116,0.0,1.0,0.0,0.0,Congressman Files New Marijuana Banking Reform Amendment To Large-Scale House Bill,0
117,0.0,1.0,0.0,0.0,Mall Customers Shop for New Hips or Knees as Surgery Centers Fill Store Vacancies,0
118,0.055,0.945,0.0,-0.3597,"What is the difference between sole proprietor and LLC, I'm making a clothing brand and I'm the only maker and seller , is it necessary to spend $500+ for a LLC? Also, what if I don't make many sales do I still have to PAY taxes instead of collecting?",-1
119,0.0,1.0,0.0,0.0,Company buyout,0
120,0.0,1.0,0.0,0.0,Starbucks union push spreads to 54 stores in 19 states,0
121,0.0,0.762,0.238,0.3612,Ohio lured Intel's chip plant with $2B incentive package,1
122,0.0,1.0,0.0,0.0,"Apple reportedly preparing low-cost iPhone, iPad for March launch",0
123,0.0,0.823,0.177,0.4215,What is an example of an online business that succeeded in your country locally?,1
124,0.266,0.734,0.0,-0.4404,TD Bank Joins Lenders Revamping Overdraft Fees Amid Criticism,-1
125,0.0,0.905,0.095,0.25,Domino's will 'tip' customers $3 if they order for pickup as the chain tries to convince customers to skip delivery,1
126,0.0,1.0,0.0,0.0,"Facebook and Google stocks have diverged, and the reason is Apple",0
127,0.0,1.0,0.0,0.0,Alphabet stock's big day could mean a windfall for Nancy Pelosi's husband,0
128,0.0,1.0,0.0,0.0,Cramer's lightning round: I don't think Rivian will be the next Tesla,0
129,0.0,1.0,0.0,0.0,German dude wants to go to America,0
130,0.0,0.689,0.311,0.3089,Lessons From Buffet: Never Lose Money,1
131,0.0,0.0,0.0,0.0,💡,0
132,0.0,1.0,0.0,0.0,Cramer's week ahead: This is a treacherous market filled with extreme stock moves,0
133,0.0,0.851,0.149,0.2732,How do I find a company that creates and manages an online store for me?,1
134,0.0,0.866,0.134,0.1779,Amazon increases the price of Prime nearly 17% to $139 per year,1
135,0.0,1.0,0.0,0.0,Cannabis has contributed $43.5 billion to Canada's GDP since legalization: report,0
136,0.0,1.0,0.0,0.0,GM Ventures invests in startup building fast charge-capable battery tech,0
137,0.0,0.636,0.364,0.6319,A reminder that good employers never have a problem finding and retaining staff,1
138,0.0,1.0,0.0,0.0,Pinterest jumps more than 25% on earnings beat as tech stocks bounce back,0
139,0.121,0.645,0.234,0.34,Starbucks to hike prices to offset inflation; lowers profit guidance,1
140,0.256,0.744,0.0,-0.4767,How do I tell my dad his business idea is terrible?,-1
141,0.0,1.0,0.0,0.0,Vinyl supply business,0
142,0.0,0.779,0.221,0.1779,Amazon has a $31 billion a year advertising business,1
143,0.0,0.444,0.556,0.7579,"Amazon surges, eyes Wall Street record gain in value",1
144,0.0,0.729,0.271,0.3818,Wage growth may be slowing from 'breakneck' pace,1
145,0.13,0.569,0.301,0.4939,Is there a way to secure your idea from being stolen while getting seed fundings from investors? Please help,1
146,0.0,0.811,0.189,0.4215,Can a charity put donations into a CRT and receive the income to cover operations?,1
147,0.0,1.0,0.0,0.0,AP News: Denver Broncos announce they are officially on the market,0
148,0.259,0.741,0.0,-0.1027,Advertising/getting potential customers to pay,-1
149,0.0,1.0,0.0,0.0,"Where to get custom boxes, bags, etc.",0
150,0.0,1.0,0.0,0.0,A Russian invasion of Ukraine could send shockwaves through financial markets — here's how,0
151,0.0,0.827,0.173,0.3182,Ford reportedly plans to increase EV spending by up to $20 billion,1
152,0.0,1.0,0.0,0.0,Tips on running my first business (Food Delivery),0
153,0.0,0.872,0.128,0.3612,Do you need a business licence if you register and start your business in a tax haven like cayman islands.,1
154,0.0,1.0,0.0,0.0,House as a business to shield yourself from a divorce,0
155,0.326,0.674,0.0,-0.4404,PayPal stock plunges on weak earnings guidance,-1
156,0.0,0.734,0.266,0.4404,"Snap shows first-ever quarterly net profit, stock pops 39%",1
157,0.365,0.635,0.0,-0.5574,SEC Executive Pay Plan Stokes Fear of Misguided Investor Votes,-1
158,0.0,1.0,0.0,0.0,"People are selling themselves their own NFTs to drive up prices, report finds",0
159,0.0,0.711,0.289,0.6908,"Nasdaq futures rise about 1% after its third day of gains, Alphabet pops on strong earnings",1
160,0.0,1.0,0.0,0.0,Democrats Renew Push to Pass Industrial Policy Bill to Counter China,0
161,0.0,1.0,0.0,0.0,Where to sell my Magaines and Posters?,0
162,0.0,0.841,0.159,0.1779,Peloton stock surges on report Amazon is among potential buyers,1
163,0.0,0.516,0.484,0.8519,Amazon reports 9% sales increase in fourth quarter and big profit gain on Rivian stake,1
164,0.0,1.0,0.0,0.0,EIN for Small Business Startup,0
165,0.0,1.0,0.0,0.0,Side hustle,0
166,0.0,0.766,0.234,0.5661,"Do you think apple's ""closed"" app store ecosystem is ethical or not? why?",1
167,0.209,0.791,0.0,-0.4404,USA: Ex Drug Firm CEO Convicted Of Steering Opioids To Dirty Doctors,-1
168,0.0,0.804,0.196,0.296,Alphabet Stock Split Aimed at Bringing Google Shares to Masses,1
169,0.243,0.651,0.107,-0.3182,"Chip shortage forces Ford to cut production of F-150, Bronco and other important vehicles",-1
170,0.0,0.799,0.201,0.7941,"Business Analysts, where did you learn how to be good at your job? Do you have any recommendations for resources that taught you the soft skills needed to be successful?",1
171,0.365,0.456,0.178,-0.3987,"Spotify is the underdog losing a propaganda battle with giants, not some evil entity",-1
172,0.0,1.0,0.0,0.0,How This Man Who Stole $65 Billion,0
173,0.298,0.702,0.0,-0.5267,Dutch public prosecutors open criminal investigation into Tata Steel,-1
174,0.0,0.541,0.459,0.7783,What is the best education for a career focused on commercial?,1
175,0.0,1.0,0.0,0.0,The Weekend Nor’easter Cost Airlines $35 Million—Less Per Day Than What Covid Costs Them,0
176,0.0,0.776,0.224,0.6369,ExxonMobil is recovering from the pandemic downturn with $23 billion in profits and plans to expand in the Permian Basin,1
177,0.119,0.593,0.288,0.4588,"How to become a better listener: « Listening is a skill that’s vitally important, sadly undertaught, and physically and mentally taxing. »",1
178,0.222,0.778,0.0,-0.25,What Will Neil Young's Protest Mean for Spotify?,-1
179,0.0,0.789,0.211,0.34,Apple privacy changes wipe $278 billion market value from 4 companies,1
180,0.167,0.833,0.0,-0.296,Suggest me a CRM or whether to avoid them altogether for repair/service/fabrication business,-1
181,0.0,1.0,0.0,0.0,Father willing to invest in business,0
182,0.0,0.843,0.157,0.3818,How do you keep a partnership alive and productive when one person does all the work?,1
183,0.0,1.0,0.0,0.0,Meta Platforms lays an egg…,0
184,0.0,1.0,0.0,0.0,Question,0
185,0.152,0.449,0.399,0.5267,Spotify Hopes To Solve Its Joe Rogan Problem By Acting Like Facebook,1
186,0.411,0.253,0.335,-0.0516,Co-op workers win legal argument in equal pay fight,0
187,0.0,1.0,0.0,0.0,Beyond Meat Sales at McDonald’s Are Through the Roof. The Stock Is Rising.,0
188,0.0,1.0,0.0,0.0,The New York Times Acquires Wordle,0
189,0.0,1.0,0.0,0.0,Long-Term Client Breakup,0
